objectid,title,state_province,HydroLAKE_ID,GRanD_id,latitude,longitude,surface_area_km2,reservoir_nonreservoir,date_dam_completion,motorboat_restriction,motorboat_restriction_notes,primary_emergent_veg,primary_veg_for_nesting,management_agency,lake_use,region_associations,ecoregion,designations,comments,max_adults,year_max_adults,most_recent_adults,year_most_recent_adults,max_nests,year_max_nests,most_recent_nests,year_most_recent_nests,max_chicks,year_max_chicks,most_recent_chicks,year_most_recent_chicks,western_clarks_both,survey_type,survey_time_period,frequency_survey,most_common_threats_reported
aech_00602,"Stone Lake, Jicarilla Reservation",New Mexico,112766,602,36.711336,-106.875782,1.4,reservoir,1965,,,,,Jicarilla Apache Nation,fisheries,"Jicarilla Apache Indian Reservation, Upper San Juan Basin",,,Managed as a trophy fishery. Stone Lake was impacted by drought in past years.,~90,"2004, 2010",~50,2012,101,2012,101,2012,3,2004,2-6,2010,"Western (1968, 1980, 1992, 1999, 2003, 2004, 2006, 2010, 2012), Clark's (2009), N/A (other years)",Shore,"9 June 1968, 5 July 2012",varies,N/A
aech_00603,Stubblefield Lake/Stubblefield Reservoir,New Mexico,,,36.5742976,-104.6628197,3.7,reservoir,1950s,,,,,New Mexico Department of Game and Fish; U.S. Bureau of Reclamation; Vermejo Conservency District,irrigation,Chico Rico Creek; Vermejo River; Maxwell National Wildlife Refuge; Laguna Madre,,,Occasional floods throughout the reservoir system's history degraded the infrastructure and farmers abandoned the area as a result. The Bureau of Reclamation eventually rehabilitated the dam. Near Maxwell National Wildlife Refuge.,88,2010,19,2010,44,2010,44,2010,8-24,2010,8-24,2010,"Western (2001, 2004, 2005, 2010), Clark's (1986, 2000, 2004, 2005, 2007, 2010), Both Clark's/Western in 2006 (equal), in 2007 (12/10), in 2010 (12/7)",Shore,"6 August 1986, 22 September 2010","varies, 1-3","Water level too low, water level too high, wind/wave inundation"
aech_00608,Lake Mead,Arizona; California; Nevada,809,610,36.018191,-114.735006,581,reservoir,1935,,,Scirpus maritimus,Scirpus maritimus,Bureau of Reclamation,water supply; irrigation; hydroelectricity,Lower Basin of the Columbia River,,,"Lake Mead is the United States' first and largest National Recreation Area and is split between Nevada and Arizona.  It captures water flow and snow melt from the Rocky Mountains.  However, recent droughts has severely reduced water flow and water levels have dropped dramatically in the reservoir.  The reservoir supplies water to 90% of southern Nevada residents.  Water levels have been declining for the last 22 years.  California, Arizona, and Nevada water authorities signed an MOU in 2019 to address low water supply issues of Lake Mead and invest in projects to conserve water into the near future.  This entry consolidates Lake Mead entries for NV, CA, and AZ for index purposes only. See individual entries for details.",>800,1995,presence?,2000,48,1995,presence?,2000,90,1993,?,2000,"See NV, AZ, CA",,"1993, 2000",N/A,"Water level too low, lack of/poor nesting habitat, wind/wave inundation"
aech_00609,"Lead Lake and Goose Lake, Stillwater National Wildlife Refuge",Nevada,,,39.6144199,-118.5075279,,non-reservoir,,,,,,U.S. Fish and Wildlife Service,,Stillwater NWR,,,Lead Lake and Goose Lake are connected and/or adjacent to each other. These coordinates are for Lead Lake.,33,1984,33,1984,N/A,N/A,N/A,N/A,8,1984,8,1984,Clark's,N/A,17 June 1984,1,N/A
aech_00610,"Pyramid Lake, also described as lake near Sutcliff near Anaho Island",Nevada,791,,40.10625,-119.58125,476.9,non-reservoir,,,,,,Pyramid Lake Paiute Reservation,,Pyramid Lake Paiute Reservation,,,"Pyramid Lake is one of Nevada's largest lakes and is what remains today of Lake Lahontan, an ancient lake that once spanned across most of the state.",8-10,1940,8-10,1940,N/A,N/A,N/A,N/A,N/A,N/A,N/A,N/A,Western,N/A,"21 June 1940, 22 June 1940",1,N/A
aech_00611,Ruby Lake National Wildlife Refuge,Nevada,,,40.1922208,-115.4692644,,non-reservoir,,,,,,U.S. Fish and Wildlife Service,,Ruby Lake NWR,,,A significant wetland in the Great Basin and Intermountain West.,6 avg,1990-1902,presence,1992,N/A,N/A,N/A,N/A,N/A,N/A,N/A,N/A,Western,N/A,"1990, 1992",N/A,N/A
aech_00613,South Fork Reservoir,Nevada,,,40.6709495,-115.7622388,6.6,reservoir,1988,,,,,Nevada Division of State Parks,recreation; water storage,South Fork State Recreation Area; Upper Humboldt Drainage,,,Built for recreational purposes. Maximum depth of 67 feet. Wate levels considered relatively stable.,36,2010,12,2011,2,2010,2,2010,N/A,N/A,N/A,N/A,"Western (2011), Both: Clark's/Western 4/28 (2010)",Shore,"13 July 2010, 14 June 2011",1,N/A
aech_00614,Unnamed lake,Nevada,,,,,,,,,,,,,,,,,"No coordinates, location not specified.",350,?,350,?,N/A,N/A,N/A,N/A,N/A,N/A,N/A,N/A,Both: Clark's/Western (300/50),N/A,N/A,N/A,N/A
aech_00615,Washoe Lake,Nevada,,,39.2661178,-119.7969952,23.5,non-reservoir,,,,,,Nevada Division of State Parks,,,,,Washoe Lake is very shallow and part of a complex of other lakes (Big Washoe Lake and Little Washoe Lake) connected by marshes. The lake complex is subject to strong winds and has been dried out due to drought conditions many times in the last 20 years.,10,1900,10,1900,N/A,N/A,N/A,N/A,N/A,N/A,N/A,N/A,Western,N/A,May 1900,1,N/A
aech_00616,Anderson Lake,Oregon,,,42.5008398,-119.8154926,,non-reservoir,,,,,,,,Warner Lakes,,,Part of the Warner Lakes chain which was once a giant deep lake. Water receded and left many lakes.,14,1987,14,1987,N/A,N/A,N/A,N/A,N/A,N/A,N/A,N/A,Western,Boat,28 May 1987,1,N/A
aech_00617,"Baca Lake, Malheur National Wildlife Refuge",Oregon,,,42.9172385,-118.8527184,,non-reservoir,,,,,,U.S. Fish and Wildlife Service,,Blitzen Valley; Malheur NWR,,,In the Blitzen Valley of Malheur NWR.,10,1980,10,1980,N/A,N/A,N/A,N/A,N/A,N/A,N/A,N/A,Western,Shore,1980,1,N/A
aech_00618,Crump Lake,Oregon,,,42.2821991,-119.8373599,31.1,non-reservoir,,,,tule,tule,Oregon Department State of Lands,,Warner Lakes; Warner Valley; Hart Lake; Flagstaff Lake; Blue Joint Lake,,,Lake is closed to public access due to very low water levels and the protection of cultural artifacts.,presence,historical,presence,historical,presence,historical,presence,historical,N/A,N/A,N/A,N/A,Western,N/A,"1922, other years?",N/A,N/A
aech_00620,"Derrick Lake, Malheur National Wildlife Refuge",Oregon,,,43.3009105,-119.3196705,,non-reservoir,,,,,,U.S. Fish and Wildlife Service,,Malheur NWR,,,In the Double-O Unit of Malheur NWR.,50,1980,20,1994,10-12,"1989, 1994",10-12,1994,N/A,N/A,N/A,N/A,Western,Shore; Air,"1980, 21 July 1994",1,N/A
aech_00621,Dog Lake,Oregon,,,42.0718633,-120.7094826,,non-reservoir,,,,,,U.S. Fish and Wildlife Service,,Fremont-Winema National Forest,,,Part of the Fremont-Winema National Forest.,presence,1943,presence,1943,presence,1943,presence,1943,N/A,N/A,N/A,N/A,Western,Boat,25 June 1943,1,N/A
aech_00622,Dry Lake Reservoir,Oregon,,,43.1549,-118.6394,,reservoir,,,,,,,,,,,There are a couple of Dry Lake Reservoirs. This one is south of New Princeton and southeast of Malheur Lake. Not much information on this reservoir.,presence,1980,presence,1980,25,1980,25,1980,N/A,N/A,N/A,N/A,Western,N/A,1980,N/A,N/A
aech_00623,Fern Ridge Reservoir/Fern Ridge Lake,Oregon,9019,90,44.117518,-123.296875,26.7,reservoir,1941,,,reed canary grass (Phalaris arundinacea; cattail (Typha latifolia); bull rush (Scirpus validus),,U.S. Army Corps of Engineers; Oregon Department of Fish and Wildlife,flood control; recreation,Willamette Valley,,,Reed canary grass is encroaching other habitat and there were plans to curtail its expansion.,208,2011,208,2011,10,2011,10,2011,1-3,1992,1-3,1992,"Western (1992, 1993), Both: Clark's/Western/Unknown is 35/120/53 (2011)",N/A,"1992, 2011",N/A,N/A
aech_00624,"Gerber/Willow Valley, Upper Klamath Basin",Oregon,9125,112,42.200573,-121.125647,13.2,reservoir,1925,,,,,U.S. Bureau of Reclamation,irrigation,Upper Klamath Basin; Gerber Recreation Area,,,A number of reservoirs in this vicinity.,468,2004,468,2004,N/A,N/A,N/A,N/A,N/A,N/A,N/A,N/A,"Both: Clark's/Western/Unknown in 2003 (47/88/113), in 2004 (96/188/184)",Shore; Air,"12 June 2003, 16 June 2004",daily,N/A
aech_00629,"Harney Lake, Malheur National Wildlife Refuge",Oregon,771,,43.228021,-119.045399,122,non-reservoir,,,,,,U.S. Fish and Wildlife Service,,Harney Basin; Malheur National Wildlife Refuge; Warm Springs Valley; Great Basin; Northern Basin and Range,,,"Harney Lake is both a Research Natural Area (RNA) and Conservation Opportunity Area (COA). The water is alkaline and has no outlet.  Water overflowing from Malheur Lake, enters Mud Lake and Harney Lake through the Narrows.  See individual entries for more details. Individual entries compiled for Harney Lake as a total for indexing purposes.",1600,1983,620,1994,1055,1984,310,1994,several,1986,several,1986,See individual entries,Boat; Air,"1980, 17 June 1994",N/A,"Water level too low, lack of/poor nesting habitat, wind/wave inundation, lack of fish food, drought/lack of precipitation/water"
aech_00630,Hart Lake,Oregon,9118,417,42.402668,-119.852229,29.6,reservoir,,,,,,U.S. Forest Service,,"Warner Lakes, Crump Lake, Flagstaff Lake, Blue Joint Lake.",,,Largest and most permanent of the Warner Lakes chain. Considered shallow.,8,1922,8,1922,N/A,N/A,N/A,N/A,N/A,N/A,N/A,N/A,Western,N/A,1922,1,N/A
aech_00631,"Hwy 205, Harney County",Oregon,,,,,,,,,,,,,,,,,"No coordinates, location not specified.",low 100s,1985,low 100s,1985,N/A,N/A,N/A,N/A,N/A,N/A,N/A,N/A,Both: Clark's/Western (40/100),N/A,24 August 1985,1,N/A
aech_00632,Klamath Basin,Oregon,,,,,,,,,,,,,,Klamath Basin National Wildlife Refuge Complex; Klamath River; Klamath Tribes; Yurok Tribe,,,"A large area of southern Oregon and northern California drained by the Klamath River. The Klamath River originates in the deserts of eastern Oregon and supported major salmon runs historically. The basin includes river, wetlands, reservoirs, forests, and deserts as well as urbanized development and agriculture. There are four major dams for which removal of them is proposed. There are six national wildlife refuges in the basin and it is a major stopover site for birds migrating on the Pacific Flyway. There has been major issues with water availability, water rights, and overallocation of water. Drought has also reduced water levels to dramatic lows in recent years.",4668,2003,4668,2003,N/A,N/A,N/A,N/A,N/A,N/A,N/A,N/A,Both: Clark's/Western (1504/3164),N/A,2003,N/A,N/A
aech_00633,Klamath County,Oregon,,,,,,,,,,,,,,Upper Klamath Lake; Klamath Basin National Wildlife Refuge Complex; Klamath Basin,,,No specifics on the location of this record within Klamath County. Numbers are very low but one of the older records in this inventory.,presence,1883,presence,1883,2-8,1883,2-8,1883,N/A,N/A,N/A,N/A,Western,N/A,1883,N/A,N/A
aech_00634,"Klamath Marsh National Wildlife Refuge, Upper Klamath Basin",Oregon,,,42.9428991,-121.6691388,,non-reservoir,,,,,,U.S. Fish and Wildlife Service,,Klamath Basin National Wildlife Refuge Complex; Klamath River; Klamath Tribes,,,A complex of wet meadows and open water wetlands. One of six wildlife refuges in the Klamath Basin.,46,2003,12,2004,N/A,N/A,N/A,N/A,N/A,N/A,N/A,N/A,"Both: Clark's/Western/Unknown in 2003 (0/12/34), in 2004 (0/3/9)",Shore; Air,"12 June 2003, 16 June 2004",daily,N/A
aech_00635,"Klamath River, Upper Klamath Basin",Oregon,777,110,42.238255,-121.814386,276.6,reservoir,1921,,,,,U.S. Fish and Wildlife Service; Bureau of Reclamation,,Klamath Basin; Upper Klamath Lake,,,Coordinates are for the river mouth on the south side Upper Klamath Lake. See main Upper Klamath Lake and Klamath Basin entries for more information.,207,2004,207,2004,N/A,N/A,N/A,N/A,N/A,N/A,N/A,N/A,"Both: Clark's/Western in 2003 (30/120), in 2004 (0/4/203)",Shore; Air,"12 June 2003, 16 June 2004",daily,N/A
aech_00636,"Knox Pond east side, Malheur National Wildlife Refuge",Oregon,,,42.8855426,-118.862283,,non-reservoir,,,,,,U.S. Fish and Wildlife Service,,Blitzen Valley; Malheur National Wildlife Refuge,,,"East side of the pond, in the Blitzen Valley of Malheur NWR.",10,1980,presence,1989,10,1980,7,1989,N/A,N/A,N/A,N/A,Western,Shore,"1980, 1989",1,N/A
aech_00637,"Krumbo Reservoir, Malheur National Wildlife Refuge",Oregon,,,42.9530242,-118.8039764,,reservoir,,entire,non-motorized and electric boats only,,,U.S. Fish and Wildlife Service,,Malheur National Wildlife Refuge,,,Krumbo Reservoir is the deepest waterbody in Malheur NWR.,10,1980,10,1980,5,1980,5,1980,N/A,N/A,N/A,N/A,Western,Shore,1980,1,N/A
aech_00638,"Langell Valley, Upper Klamath Basin",Oregon,,,42.005942,-121.223202,,,,,,,,,,,,,"Coordinates are for Malone Reservoir which is the closest, largest waterbody to Langell Valley. No specific location was named in this Valley so uncertain if this is the right lake/reservoir.",1,2003,1,2003,N/A,N/A,N/A,N/A,N/A,N/A,N/A,N/A,Both: Clark's/Western (0/1),Shore; Air,"12 June 2003, 23 June 2003",daily,N/A
aech_00639,Lower Klamath Lake Historic,Oregon,,,42.0762155,-121.8022878,,non-reservoir,,,,,,U.S. Fish and Wildlife Service,,Klamath Basin,,,"Part of the Klamath Basin, the Bureau of Reclamation dammed the historical lake to drain it for agriculture in 1905. Remnants of the wetlands remain on the California-Oregon border. These coordinates from Ivey's database.",thousands,1905,presence,1906,thousands,1905,presence,1906,N/A,N/A,N/A,N/A,Western,Boat,"1905, 1906",1,N/A
aech_00646,"Malheur Lake, Malheur National Wildlife Refuge",Oregon,769,,43.327083,-118.785417,300.3,non-reservoir,,,,tule,tule,U.S. Fish and Wildlife Service,,Harney Basin; Malheur National Wildlife Refuge; Warm Springs Valley; Great Basin; Northern Basin and Range,,,"Malheur Lake is a Conservation Opportunity Area (COA) and part of Malheur National Wildlife Area. The lake and refuge is a major site for birds on the Pacific Flyway. Water issues include water quality degradation, water use that exceeds groundwater recharge, invasive carp, and decreased water level due to severe drought conditions. See individual entries for more details. Individual entries compiled for Malheur Lake area as a total for indexing purposes.",5816,1981,400-500,1998,4091,1983,200,1998,N/A,N/A,N/A,N/A,"Varies, see individual entries.",Boat; Air,"1960s, 1998",See individual entries,"Water level too low, water level too high, wind/wave inundation, lack of/poor nesting habitat, lack of fish food, drought/lack of precipitation/water"
aech_00653,Malheur National Wildlife Refuge,Oregon,769,,43.327083,-118.785417,,non-reservoir,,,,,hardstem bulrush,U.S. Fish and Wildlife Service,,Harney Basin; Malheur National Wildlife Refuge; Warm Springs Valley; Great Basin; Northern Basin and Range,,,"Data was for Malheur National Wildlife Refuge in general without specific location given in data sources. Malheur Lake is the largest waterbody within the refuge so coordinates are for that lake, though there are other waterbodies in the refuge boundaries. See Malheur Lake for more information about the refugte.",~6000,1970s-1990s,?,1998,400,1990-1998,?,1998,N/A,N/A,N/A,N/A,"Both in 1990-1998: Clark's/Western (200/660), Both in 1907s-1990s",N/A,"1970s, 1998",N/A,"Water level too low, lack of fish food"
aech_00654,"Mud Lake, Malheur National Wildlife Refuge",Oregon,,,43.2612195,-119.0137756,,non-reservoir,,,,,,U.S. Fish and Wildlife Service,,Harney Basin; Malheur National Wildlife Refuge; Warm Springs Valley; Great Basin; Northern Basin and Range,,,Between Harney Lake and Malheur Lake.  Overflow from Malheur Lake flows into Mud Lake and Harney Lake.,400,1983,400,1983,200,1983,200,1983,N/A,N/A,N/A,N/A,Western,Shore; Air,"1980, 3 August 1983",1,N/A
aech_00655,Paulina Marsh,Oregon,,,43.2176301,-121.0148186,,non-reservoir,,,,,,,,,,,Inexact location of colony according to Ivey. North of Silver Lake.,presence,1913,presence,1913,presence,1913,presence,1913,N/A,N/A,N/A,N/A,Western,N/A,1 May 1913,1,N/A
aech_00656,"Sprague River Valley, Upper Klamath Basin",Oregon,,,42.548265,-121.621093,,,,,,,,,,Upper Klamath Basin,,,This is a large general area so these Google Earth coordinates are an estimate.,65,2003,31,2004,N/A,N/A,N/A,N/A,N/A,N/A,N/A,N/A,"Both: Clark's/Western/Unknown in 2003 (1/7/57), in 2004 (0/26/5)",Shore; Air,"12 June 2003, 16 June 2004",daily,N/A
aech_00657,Spring Lake,Oregon,,,42.0943245,-121.7464258,,non-reservoir,,,,,,,,Upper Klamath Basin,,,"In Klamath County, not much information on this lake.",40,2000,40,2000,4,2000,4,2000,N/A,N/A,N/A,N/A,Both,Boat,16 August 2000,1,N/A
aech_00658,"Spring Lake Valley/Lost River area, Upper Klamath Basin",Oregon,,,42.142707,-121.673239,,,,,,,,,,Upper Klamath Basin,,,This is a large general area so these Google Earth coordinates are near the Lost River Dam for reference.,89,2003,65,2004,2,2004,2,2004,N/A,N/A,N/A,N/A,"Both: Clark's/Western/Unknown in 2003 (1/14/74), in 2004 (0/7/58)",Shore,"12 June 2003, 16 June 2004",daily,N/A
aech_00660,Stone Corral Lake,Oregon,,,42.6188478,-119.6918547,,non-reservoir,,,,,,Bureau of Land Management,,Warner Lakes,,,"Grebes breeding in the marsh north of this lake in Lake County, part of the Warner Chain of lakes.",28,1987,28,1987,14,1987,14,1987,N/A,N/A,N/A,N/A,Western,Boat,11 June 1987,1,N/A
aech_00661,Summer Lake WA,Oregon,774,,42.83125,-120.74375,109,non-reservoir,,,,,,Oregon Department of Fish and Wildlife,,Summer Lake Wildlife Area; Northern Great Basin,,,"This was the state's first Wildlife Area, established in 1944. It is spring fed and may have existed for 10,000 years or so. However, the pumping of water for agriculture threatens to dry it up.  Includes areas of Dutchy Lake, Gold Dike Impoundment, Rest Lake, Link Marsh, North Bullgate Refuge, and North Levee Impoundment",100-150,2000s,100-150,2000s,50-75,2000s,50-75,2000s,N/A,N/A,N/A,N/A,"Western, Both (2000s)",N/A,"?, 2000s",N/A,N/A
aech_00663,"Swan Lake area, Upper Klamath Basin",Oregon,,,42.321705,-121.6099268,,,,,,,,Bureau of Land Management,,Upper Klamath Basin; Lost River Basin; Swan Lake Valley,,,Swan Lake was the site of a proposed hydroelectric facility. Water is drawn from the Swan Lake Valley for irrigation.,12,2004,12,2004,N/A,N/A,N/A,N/A,N/A,N/A,N/A,N/A,Both,Air,"9 June 2004, 16 June 2004",daily,N/A
aech_00664,"Thompson Reservoir/Thompson Valley Reservoir, Upper Klamath Basin",Oregon,111132,105,42.959227,-121.086072,8.1,reservoir,1926,,,,,U.S. Forest Service; Silver Lake Irrigation District,,Fremont-Winema National Forest; Silver Creek; Upper Klamath Basin,,,Thompson Reservoir is on Silver Creek in the Fremont-Winema National Forest in Lake County.,42,2004,42,2004,N/A,N/A,N/A,N/A,N/A,N/A,N/A,N/A,Both: Clark's/Western/Unknown in 2004 (0/6/36),Shore; Air,"12 June 2003, 16 June 2004",daily,N/A
aech_00665,Tule Lake Historic,Oregon,,,42.0130845,-121.4327715,,,,,,,,,,Klamath Basin,,,"Part of the Klamath Basin, the Bureau of Reclamation dammed the historical lake to drain it for agriculture in 1905. Remnants of the wetlands remain on the California-Oregon border. These coordinates from Ivey's database.",presence,1905,presence,1905,presence,1905,presence,1905,N/A,N/A,N/A,N/A,Western,N/A,1905,1,N/A
aech_00670,"Upper Klamath Lake, Upper Klamath Basin",Oregon,777,110,42.238815,-121.811463,276.6,non-reservoir,1921,,,,,Bureau of Reclamation; U.S. Fish and Wildlife Service,,"Klamath Basin, Klamath Basin National Wildlife Refuges, Upper Klamath National Wildlife Refuge, Upper Klamath Basin",,,"Upper Klamath Lake is a major site for waterfowl and waterbirds but has suffered from low water levels in recent years due to overallocation of water and drought. Upper Klamath Lake, in general, is the most important site for Western and Clark's grebes in the Klamath Basin, supporting >60% of these grebes for all seasons. It is part of the Upper Klamath National Wildlife Refuge. There are six national wildlife refuges in the Klamath Basin and the area is a significant stopover site for birds migrating on the Pacific Flyway. There has been major issues with water availability, water rights, and overallocation of water in the basin. Drought has also reduced water levels to dramatic lows in recent years. See Klamath Basin entry for more information on this region. See individual entries for more details. Individual entries compiled for Upper Klamath Lake area as a total for indexing purposes. Includes Upper Klamath Marsh, Williamson River Delta Preserve, and Upper Klamath National Wildlife Refuge which are all part of the lake.",7354,2004,8 (Goose Bay only),2011 (Goose Bay only),>1400,2004,4,2011 (Goose Bay only),731-2193,2004,731-2193,2004,"Western in 2011 (Goose Bay), Western in 1993 and historically, both in other years",Shore; Boat; Air,"Historical, 2011","varies, 1 to daily, see individual entries","Lack of/poor quality nesting habitat, poaching/direct killing by humans"
aech_00672,"Upper Klamath National Wildlife Refuge, Upper Klamath Lake, Upper Klamath Basin",Oregon,777,110,42.50583,-122.020544,,non-reservoir,,,,,,U.S. Fish and Wildlife Service,,"Klamath Basin, Klamath Basin National Wildlife Refuges, Upper Klamath National Wildlife Refuge, Upper Klamath Basin",,,"The Upper Klamath National Wildlife Refuge is at the northern portion of Upper Klamath Lake and is one of six National Wildlife Refuges in the Klamath Basin.  It is a remnant of one of the largest wetlands of the west and is an important bird area, especially for waterbirds.  See main Upper Klamath Lake and Klamath Basin entries for more information.",489,2003,489,2003,N/A,N/A,N/A,N/A,N/A,N/A,N/A,N/A,Both: Clark's/Western (64/425),Shore; Air,"12 June 2003, 23 June 2003",daily,N/A
aech_00673,Warner Basin/Warner Lakes/Warner Potholes,Oregon,,,42.459435,-119.837633,,non-reservoir,,,,,,U.S. Bureau of Land Management; Oregon Department of State Lands; private,,Crump Lake; Hart Lake; Flagstaff Lake; Blue Joint Lake.,,,"Warner Basin was once a giant deep lake. Water receded and left interconnected lakes such as Crump Lake, Anderson Lake, Hart Lake, Flagstaff Lake, and Blue Joint Lake. This is an important stopover site for migrating birds and is an Area of Critical Environmental Concern (ACEC) and a Conservation Opportunity Area (COA). The water is used for irrigation depending on year but if Hart Lake dries up, the rest of the valley is dry.",3000,1987,3000,1987,1500,1987,1500,1987,N/A,N/A,N/A,N/A,Western,Boat,"historical, 26 May 1987",N/A,N/A
aech_00674,"Yonna Valley area, Upper Klamath Basin",Oregon,,,42.207065,-121.477008,,,,,,,,,,Upper Klamath Basin,,,"Yonna Valley is one of the basins of Klamath Basin when it was part of a large ancient lake that has since been drained. Yonna Valley area includes Alkali Lake (surveyed by shore and air), Short Lake (surveyed by air), and Yonna Valley in general (surveyed by shore). Coordinates are for Alkali Lake though that might not be location where grebes were found in 2004.",8,2004,8,2004,N/A,N/A,N/A,N/A,N/A,N/A,N/A,N/A,Both,Shore; Air,"9 June 2004, 16 June 2004",daily,N/A
aech_00675,0.5 mi east of Mound City,South Dakota,,,45.727116,-100.052278,,,,,,,,,,,,,No coordinates nor exact location given. Coordinate location entered here is best estimate based on description. 0.5 mi east of Mound City,presence,2010,presence,2010,N/A,N/A,N/A,N/A,presence,2010,presence,2010,Western,N/A,17 July 2010,1,N/A
aech_00676,0.7 mi east of Hecla on 104 St.,South Dakota,,,45.879757,-98.130705,,,,,,,,,,,,,No coordinates nor exact location given. Coordinate location entered here is best estimate based on description. 0.7 mi east of Hecla on 104 St.,presence,2010,presence,2010,N/A,N/A,N/A,N/A,presence,2010,presence,2010,Clark's,N/A,1 August 2010,1,N/A
aech_00677,101 St. @ 453 Ave,South Dakota,,,45.921635,-97.146346,,,,,,,,,,,,,"No coordinates nor exact location given. Coordinate location entered here is best estimate based on description. Cross street entered into Google Earth is in Norway, SD. 101 St. at 453 Ave",8,2007,8,2007,N/A,N/A,N/A,N/A,3-9,2007,3-9,2007,Western,N/A,20 June 2007,1,N/A
aech_00678,104 St/Hecla Ponds,South Dakota,,,45.878836,-98.181903,,,,,,,,,,,,,No coordinates nor exact location given. Coordinate location entered here is best estimate based on description. 104 St/Hecla Ponds,presence,2020,presence,2020,N/A,N/A,N/A,N/A,presence,2020,presence,2020,Western,N/A,9 August 2020,1,N/A
aech_00679,123 St - 413.5 Ave,South Dakota,,,45.591987,-97.941368,,,,,,,,,,,,,No coordinates nor exact location given. Coordinate location entered here is best estimate based on description.,presence,2012,presence,2012,N/A,N/A,N/A,N/A,6-18,2012,6-18,2012,Western,N/A,24 July 2012,1,N/A
aech_00680,150 St Farm pond,South Dakota,,,,,,,,,,,,,,,,,No coordinates nor exact location given. Description is too vague to locate.,presence,2007,presence,2007,N/A,N/A,N/A,N/A,6-18,2007,6-18,2007,Western,N/A,9 July 2007,1,N/A
aech_00681,16306 447th Avenue; Florence; South Dakota; US (45.019; -97.27),South Dakota,,,45.018553,-97.266914,,,,,,,,,,,,,Coordinates are closest waterbody to coordinates provided in description.,54,2022,54,2022,N/A,N/A,N/A,N/A,presence,2022,presence,2022,Western,N/A,30 July 2022,1,N/A
aech_00682,177 St.-331 Av SW corner,South Dakota,,,,,,,,,,,,,,,,,No coordinates nor exact location given. Description is too vague to locate.,presence,2011,presence,2011,N/A,N/A,N/A,N/A,presence,2011,presence,2011,Western,N/A,25 July 2011,1,N/A
aech_00683,"Unnamed three locations, Roberts County",South Dakota,,,,,,,,,,,,,,,,,No coordinates nor exact location given. Description is too vague to locate.,105,2012,105,2012,N/A,N/A,N/A,N/A,26-78,2012,26-78,2012,Western,N/A,28 July 2012,1,N/A
aech_00684,3.25 mi east of Hecla on 104 St. Portage Ditch @ 104 St.,South Dakota,,,45.878449,-98.072245,,,,,,,,,,,,,No coordinates nor exact location given. Coordinate location entered here is best estimate based on description.,many,2010,many,2010,N/A,N/A,N/A,N/A,many,2010,many,2010,Western,N/A,20 July 2010,1,N/A
