objectid,title,state_province,HydroLAKE_ID,GRanD_id,latitude,longitude,surface_area_km2,reservoir_nonreservoir,date_dam_completion,motorboat_restriction,motorboat_restriction_notes,primary_emergent_veg,primary_veg_for_nesting,management_agency,lake_use,region_associations,ecoregion,designations,comments,max_adults,year_max_adults,most_recent_adults,year_most_recent_adults,max_nests,year_max_nests,most_recent_nests,year_most_recent_nests,max_chicks,year_max_chicks,most_recent_chicks,year_most_recent_chicks,western_clarks_both,survey_type,survey_time_period,frequency_survey,most_common_threats_reported
aech_00179,Lake Isabella,California,,,35.669925,-118.4278184,23.8,reservoir,1953,,,,,"Kern County Parks and Recreation, U.S. Forest Service, U.S. Army Corps of Engineers",flood control; irrigation; hydroelectricity; recreation,"Kern River, Sequoia National Forest, Central Valley, Bakersfield",,,Open water can experience gusts up to 60 mph.,presence,1994?,presence,1994?,presence,1994?,presence,1994?,N/A,N/A,N/A,N/A,Both,N/A,1994?,,N/A
aech_00180,Lake Mendocino,California,112352,169,39.197467,-123.180998,6.8,reservoir,1959,,,,,U.S. Army Corps of Engineers; Sonoma Water,flood control; hydroelectricity; water supply; irrigation,Russian River Watershed; Northern Interior,,,Dual-purpose reservoir that is used for flood control and provides water supply.,presence?,2013,presence?,2013,N/A,N/A,N/A,N/A,N/A,N/A,N/A,N/A,Both,Boat,"April 2012, October 2013",N/A,Water quality/contaminants/oil spill
aech_00181,Lake Merced,California,,,37.7209334,-122.4935964,3,non-reservoir,,partial,No gas-powered in the North Merced only,,,San Francisco Recreation and Parks Department; San Francisco Public Utilities Commission,,San Francisco,,,"Spring fed dual lake system that is larger than other San Francisco area lakes. In the 1980s, surrounding golf courses drew groundwater for irrigation, drawing down water levels. In 1994, lake levels reached record low of 14 feet in depth. Lake level top off level is 30 feet.",presence,"1885, 1926",presence,1926,presence,"1885, 1926",presence,1926,N/A,N/A,N/A,N/A,Both,N/A,"1885, 1926",,N/A
aech_00182,Lake San Antonio,California,9337,230,35.8082364,-120.9011529,17 (North and South Shores),reservoir,1967,,,,,"Monterey County Water Resources Agency; Monterey County Department of Public Works, Facilities, & Parks",ground water recharge; flood control,Lake San Antonio Recreation Area,,,The reservoir's main use is for groundwater recharge and flood control. Part of Lake San Antonio Recreation Area.,presence,"1994?, 2012",presence,2012,presence,"1994?, 2012",presence,2012,N/A,N/A,N/A,N/A,Both,Boat,"1994?, October 2013",N/A,Water quality/contaminants
aech_00183,Lake Shastina,California,111717,121,41.539004,-122.376042,5.5,reservoir,1928,,,,,California State Water Resources Control Board (CEDEN),irrigation,Shasta Valley; Siskiyou County,,,Provides irrigation water for the Shasta Valley.,300,2009,300,2009,presence,1990s,0,2009,0,2009,0,2009,Both,Shore,"1990s, 2 August 2009",N/A,Water level too low
aech_00184,Lake Skinner/Skinner Reservoir,California,,,33.587,-117.072,3.5,reservoir,1973,,,,,Riverside County Regional Park and Open-Space District; Metropolitan Water District,recreation; storage; regulation; municipal,Lake Skinner Recreation Area,,,"Water is brought in from the Rocky Mountains and Northern California, where it is more plentiful, into this and other reservoirs in Southern California.  Part of Lake Skinner Recreation Area.",100,2007,100,2007,0,2007,0,2007,30,2007,30,2007,Both,Shore,8 September 2007,1,N/A
aech_00185,Lake Success,California,,,36.061,-118.922,3.6,reservoir,1961,,,,,U.S. Army Corps of Engineers,flood control; water supply; hydroelectricity; recreation,Tule River; Central Valley; Sacramento; Sierra Nevada foothills,,,Multipurpose reservoir is also managed for wildlife habitat.,presence?,2013,presence?,2013,N/A,N/A,N/A,N/A,N/A,N/A,N/A,N/A,Both,Boat,"April 2012, October 2013",N/A,Water quality/contaminants
aech_00187,Los Banos Reservoir/Los Banos Creek Reservoir,California,112742,228,36.991883,-120.933041,2.5,reservoir,1966,partial,5 mph limit,,,US Bureau of Reclamation; California Department of Water Resources; California Department of Parks and Recreation; California Department of Fish and Wildlife,flood control; recreation,Central Valley,,,Popular for fishing.,presence,"~1938, 2003?",presence,2003?,presence,"~1938, 2003?",presence,2003?,N/A,N/A,N/A,N/A,Both,Air,"~1938, 5 August 2003",N/A,N/A
aech_00188,Loveland Reservoir,California,,,32.7871849,-116.7747877,1.8,reservoir,,,,,,Sweetwater Authority; U.S. Forest Service,water supply,Sweetwater River; San Diego County; Southern California,,,This reservoir supplies water to Chula Vista and Bonita.,8,1998,1,1998,1,1998,1,1998,N/A,N/A,N/A,N/A,Clark's,N/A,"29 April 1998, 22 June 1998",N/A,N/A
aech_00189,"Lower Klamath Lake, Lower Klamath National Wildlife Refuge",California,,,41.9908483,-121.7431632,807,reservoir,,,,tule; hardstem bulrush (Scirpus acutus),tule; bulrush; sago pondweed,U.S. Fish and Wildlife Service,,Lower Klamath Basin; Klamath Basin National Wildlife Refuge Complex; Klamath River,,,"Combined records for Lower Klamath Lake and just Lower Klamath NWR because the lake comprises a big part of the refuge and assuming these records are regarding same approximate locations. At California-Oregon border, this lake became dry and is facing a water crisis at what is a major migratory bird stopover. It also has major water quality issues.",,,,,,,,,,,,,,,,,
aech_00191,"Lower Klamath private area, includes Chalk Banks/The Honker Hunt Clubs, Indian Tom Lake and area south of, Alkali Lakes, and Marsh Island Ranch",California,,,41.994043,-121.879816,,,,,,,,Private,,Lower Klamath Basin,,,"Lower Klamath private area includes Chalk Banks/The Honker Hunt Clubs, Indian Tom Lake, area south of Indian Tom, Alkali Lakes, and Marsh Island Ranch. These coordinates are for Indian Tom Lake because that is the only searchable location on Google Earth.",50,"2003, 2004",50,2004,19,2004,19,2004,N/A,N/A,N/A,N/A,"Both: Clark's/Western in 2003 (12/38), in 2004 Clark's/Western/Unknown (14/35/1)",Shore; Air,"12 June 2003, 16 June 2004",daily,N/A
aech_00192,Lower Otay Reservoir/Lower Otay Lake,California,113591,671,32.614817,-116.927368,3.3,reservoir,1919,,,,,San Diego Public Utilities Department; City of San Diego Water Department,water supply; navigation; other,San Diego,,,Supplies water for San Diego area. Houses the United States Olympic Training Center for rowing.,250,2008,presence?,2013,presence,"1999-2001, 2008",10,2008,presence,"1999, 2008",4,2008,"Western in 1999 and 2000, Clark's in 2001, both other years",Shore; Boat,"1999, October 2013",N/A,"Water quality/contaminants, human/development/boat disturbance"
aech_00193,Modoc National Wildlife Refuge,California,,,41.461102,-120.52382,,,,,,,,U.S. Fish and Wildlife Service,,Great Basin; Klamath Basin,,,Coordinates are for Goose Pond of the refuge though no specific location was named. East of the Klamath Basin on the western edge of the Great Basin.,presence,1990s,presence,1990s,presence,1990s,presence,1990s,N/A,N/A,N/A,N/A,Both,N/A,1990s,N/A,N/A
aech_00194,Mono Basin,California,,,37.963242,-118.943205,,both,,,,,,Los Angeles Department of Water and Power (LADWP); U.S. Forest Service; Bureau of Land Management; Mono County,,Mono Lake; Eastern Sierra Nevada,,,"Mono Lake was the location Ivey cites but D. Shuford believes it is Mono Basin in general because Mono Lake is historically and currently hypersaline and without fish nor vegetation. Coordinates are for Mono Basin which is adjacent to Mono Lake, one of the oldest lakes of North America. Water is diverted from Mono Lake tributaries in the basin via the Los Angeles Water Aqueduct system for use in the Los Angeles metropolitan area. The basin is a large area that includes both natural lakes and reservoirs.",presumably ~500 to 1000,1940,presumably ~500 to 1000,1940,~500,1940,~500,1940,N/A,N/A,N/A,N/A,Both,N/A,1940,N/A,Lack of/poor nesting habitat
aech_00195,Mountain Meadows Reservoir (Walker Lake),California,9188,136,40.282206,-121.023036,18.7,reservoir,1924,,,,,Pacific Gas & Electric Company; Feather River Land Trust; California Department of Fish and Wildlife; Mountain Meadows Conservancy,water supply; pollution control; other,Mountain Meadows; Basin Lake Almanor,,,Mountain Meadows Reservoir is a conservation easement that allows public access. The reservoir went dry in 2015 due to drought and structural problems and CA Department of Fish and Wildlife worked to restore the fishery. Shallow lake where deepest part is 16 feet.,150,2008,50,2009,25,2008,3,2009,11,2008,0,2009,Both,Shore; Air,"19 August 2003, 12 August 2009",1-2,N/A
aech_00196,Northern California,California,,,,,,,,,,,,,,Northern California,,,"General description of a large region. This is a summary of Northern California lakes (Tule Lake NWR, Lake Earl, Eagle Lake, Mountain Meadows Reservoir, Lake Almanor, Thermalito Afterbay, East Park Reservoir, Clear Lake, and Mendota Wildlife Area).",10600,2008,10600,2008,1370,2008,1370,2008,1566,2008,1566,2008,Both,N/A,2008,N/A,N/A
aech_00197,"Great Basin (CA, NV, UT, OR, WY)",California; Nevada; Utah; Oregon; Wyoming,,,,,,,,,,,,U.S. Bureau of Land Management (management of most of the land in the basin),,Great Basin,,,"A modelling research article, not a survey. The Great Basin is a large arid region that includes smaller basins, such as the Great Salt Lake and the Klamath Basin. Precipitation does not flow out towards the ocean but rather evaporates or sinks into groundwater and interior waterbodies that tend to be saline. The Great Basin is one of the dryest regions of the U.S. and spans across the states of Nevada, Utah, and parts of Wyoming, Oregon, Idaho, and California. Temperate desert, sagebrush landscapes, saline lakes, and mountainous terrain support a diversity of wildlife. The Great Basin faces water resource challenges like other arid regions. High water demand, drought, and climate change have resulted in drastically low water levels in waterbodies throughout the region. Various public-private partnership alliances and resolutions have been proposed to address these ongoing resource issues.",,,,,,,,,,,,,,,,,
aech_00199,O'Neill Forebay,California,112726,225,37.09375,-121.047917,8.7,reservoir,1966,,,,,California Department of Fish and Wildlife; U.S. Bureau of Reclamation,hydroelectricity,Central Valley Project; San Luis Joint Use Project; O'Neill Forebay Wildlife Area,,,,"15 (2007), presence (other years)","1990s, 2003?, 2013, 2007",presence?,2013,presence,1990s,0,2007,0,2007,0,2007,Both,Shore; Boat; Air,"1990s, October 2013",N/A,Water quality/contaminants
aech_00200,"O'Neill Lake/Lake O'Neill, Camp Pendleton",California,,,33.3295568,-117.3227506,,reservoir,,,,,,U.S. Marine Corps; U.S. Bureau of Reclamation,,Lake O'Neill Recreational Park; Camp Pendleton; Santa Margarita River,,,"In San Diego County, O'Neill Lake is different from O'Neill Forebay. Western and Clark's grebes were mostly wintering species in San Diego County lakes and reservoirs until the 1950s, when they started to breed there. Unitt (2004) proposes that building dams, filling reservoirs, and stocking them with fish encouraged grebes to breed in those inland waters in increasing numbers.",12,2001,12,2001,presence,1999-2001,presence,1999-2001,1,2001,1,2001,Both,N/A,"1999, 30 July 2001",N/A,N/A
aech_00201,Klamath Basin,California; Oregon,,,,,,,,,,,,,,Klamath Basin,,,"An estimated total of Klamath Basin with no specific location. This is a very large region so no coordinates provided nor entered here. Klamath Basin is an important region for grebe breeding and the adult numbers represent 5% of Clark's grebes and 15% to 30% of Western grebes of their North American population at the time. The Central Subregion had 70% to 80% of the Western and Clark's grebes surveyed in 2003 and 2004. This region includes the Upper Klamath Lake area, Sprague River Valley, Klamath River, Spring Lake area, Yonna Valley area, and Gerben/Willow Valley area.",,,,,,,,,,,,,,,,,
aech_00203,Palmdale Lake,California,,,34.5514795,-118.1209066,1.1,reservoir,1924,,,,,Palmdale Fin and Feather Club (private); Palmdale Water District,water supply; recreation,Los Angeles; California State Water Project,,,Palmdale Fin and Feather Club leases the lake from the Palmdale Water District.,75,2007,75,2007,presence,1990s,presence,1990s,20,2007,20,2007,Both,Shore,"1990s, 12 September 2007",N/A,N/A
aech_00204,Perris Reservoir (Lake Perris),California,113247,643,33.844532,-117.182292,8.5,reservoir,1973,,,,,California Parks and Recreation Department,irrigation,Lake Perris Recreation Area; California State Water Project,,,Perris Reservoir is the most southern reservoir of the California State Water Project.,300,2007,presence?,2013,N/A,N/A,N/A,N/A,0,2007,0,2007,Both,Shore; Boat,"11 September 2007, October 2013",N/A,Water quality/contaminants
aech_00205,Ramer Lake,California,,,33.0774049,-115.5118959,,non-reservoir,,,,,,California Department of Fish and Wildlife,,"Imperial Wildlife Area, Salton Sea; Finney Lake",,,"In the Salton Sea area, this lake is part of Imperial Wildlife Area near Finney Lake and is closed.",presence,2000-2004?,presence,2004?,5-10,2000-2004?,5-10,2004?,N/A,N/A,N/A,N/A,Both,N/A,"2000, 2004?",N/A,N/A
aech_00206,Sacramento National Wildlife Refuge,California,,,39.416691,-122.161432,,,,,,Tule (Typhus sp. and Sciurpus sp.),Tule (Typhus sp. and Sciurpus sp.),U.S. Fish and Wildlife Service,recreation,Central Vally; Sacramento NWR,,,"No specific location provided at this refuge. Coordinates are for Pool 2, the largest waterbody in the refuge. This refuge is part of a complex of refuges in the Central Valley and the last known remnant of a large Central Valley grebe population. A few grebes attempt to nest here every year. The lake was drained and refilled in March 1976. The lake was drained and refilled in March 1976. Current drought conditions.","9 (1976), presence (other years)","1976, early 1980s, early 1990s",presence,early 1990s,presence,"1976, early 1980s, early 1990s",presence,early 1990s,0,1976,0,1976,Both,N/A,"1976, early 1990s","4 (1976), N/A for other years","Water level fluctuation (too high and low), wind/wave inundation"
aech_00207,"Salton Sea, Sonny Bono Salton Sea National Wildlife Refuge",California,829,,33.335417,-115.835417,956.9,non-reservoir,,,,,,U.S. Fish and Wildlife Service; California Department of Fish and Wildlife; Salton Sea Authority,,Sonny Bono Salton Sea NWR; Salton Sea State Recreation Area; Coachella Valley; Imperial Irrigation District; Historic Colorado River Delta,,,"The largest lake in California, the Salton Sea is a terminal lake that is 50% saltier than the sea. While functioning as a sump for agriculture runoff, it has is one of the largest most biodiverses avian communities in the southwest. It is threatened by increasing salinity and water quality issues.",212,2007,212,2007,presence,"1944, unknown year",presence,"1944, unknown year",1,1956,0,2007,"Both, Western (1976)",Shore,"1944, 11 September 2007","4 (1976), 1 (2007), other years N/A","Lack of/poor quality nesting habitat, wind/wave inundation"
aech_00209,San Dieguito Reservoir,California,,,33.0394789,-117.1937578,0.3,reservoir,1918,,,,,Santa Fe Irrigation District (SFID); San Dieguito Water District (SDWD),water supply; flood control; irrigation,Lake Hodges; San Dieguito Watershed Management Area; San Dieguito River,,,This terminal reservoir stores water from Lake Hodges and provides emergency water to the Santa Fe Irrigation District (SFID) and the San Dieguito Water District (SDWD). It also serves as a flood control facility and is fenced off and closed to public access.,50,1997,60,1998,presence,"1997, 1998",presence,1998,5-15,1997,2,1998,Both: Clark's/Western (10/50 in 1998),N/A,"1997, 21 February 1998",N/A,N/A
aech_00210,San Jacinto Lake (Mystic Lake),California,,,38.88074,-121.8101975,,non-reservoir,,,,,,Lakeview Investment Company (private); U.S. Army Corps of Engineers,,San Jacinto Valley; southern California,,,Construction of levees diverted water away from this lake and it remains either dry or ephemeral. This lake along with the wetland complex of the valley is considered a significant inland wetland of California. Was dry for 15 years until rain filled it with water again in 2019.,presence,1916,presence,1916,1,1916,1,1916,N/A,N/A,N/A,N/A,Western,N/A,5 May 1916,1,N/A
aech_00211,San Joaquin Marsh Wildlife Sanctuary,California,,,33.662842,-117.842013,1.2,non-reservoir,,,,Cattails (Typha sp.); bulrush (Schoenoplectus sp.),,Irvine Ranch Water District,water treatment,San Diego Creek,,,The San Joaquin Marsh Wildlife Sanctuary are a complex of constructed wetlands used to hold urban runoff water for Irvine River Water District's Natural Water Treatment System.,presence,2013-2020,presence,2020,8,2019,7,2020,N/A,N/A,N/A,N/A,Both,N/A,"2013, 2020",N/A,N/A
aech_00212,San Luis National Wildlife Refuge,California,,,37.224635,-120.861973,,,,,,,,U.S. Fish and Wildlife Service,,San Luis Refuge Complex; Bear Creek; Salt Slough; San Joaquin River floodplain; Central California,,,One the last remaining historic wetlands in the Pacific Flyway in central California. No specific location named in the refuge so coordinates are of a large waterbody within the refuge.,presence,2000s,presence,2000s,presence,2000s,presence,2000s,N/A,N/A,N/A,N/A,Both,N/A,2000s,N/A,N/A
aech_00213,Shasta Valley WA,California,,,41.686875,-122.478482,,,,,,,,California Department of Fish and Wildlife,,Siskiyou; Shasta Valley,,,No specific location given for this WA so coordinates are for Trout Lake. Shasta Valley Wildlife Area has lack of water currently and is shut down.,presence,2000-2004?,presence,2004?,~13,2000-2004?,~13,2004?,N/A,N/A,N/A,N/A,Western,N/A,"2000, 2004?",N/A,N/A
aech_00215,South Wilbur Flood Area,California,,,,,,,,,,,,,,,,,Cannot locate this site in Ivey (2004) but it is in Kings County.,<100,1982,<100,1982,N/A,N/A,N/A,N/A,N/A,N/A,N/A,N/A,Both,N/A,1982,N/A,N/A
aech_00216,"Southern California summary of Cachuma Reservoir, Casitas Reservoir, Skinner Reservoir, Lake Hodges, and Lower Otay",California,,,,,,,,,,,,,,Southern California,,,"This is a Southern California summary of Cachuma Reservoir, Casitas Reservoir, Skinner Reservoir, Lake Hodges, and Lower Otay, not about an individual lake.",2800,2008,2800,2008,460,2008,460,2008,547,2008,547,2008,Both,Shore; Boat; Air,2008,N/A,N/A
aech_00217,Stockton,California,9273,1006,37.953765,-121.297288,,,,,,,,,,,,,"Uncertain location in Stockton. Ivey 2004 refers to Stockton as ""before the Delta was reclaimed."" Coordinates for ""The Delta"" area of Stockton, which is near McLeod Lake.",presence,early 1910s?,presence,early 1910s?,presence,early 1910s?,presence,early 1910s?,N/A,N/A,N/A,N/A,Both,N/A,early 1910s?,N/A,N/A
aech_00218,Stony Gorge Reservoir,California,112262,146,39.585442,-122.530468,4.1,reservoir,1928,,,,,U.S. Bureau of Reclamation,irrigation,Orland Project; Great Basin,,,This reservoir is a warm water fishery. The California Office of Environmental Health Hazard Assessment issued a fish advisory for this reservoir.,presence?,"2003, 2013",presence?,2013,N/A,N/A,N/A,N/A,N/A,N/A,N/A,N/A,Both,Boat; Air,"5 August 2003, October 2013",N/A,Water quality/contaminants
aech_00219,Sutter Basin,California,,,38.9304522,-121.7132986,,non-reservoir,,,,,,Sutter Mutual Water Company (SMWC); Bureau of Reclamation; Basin Irrigation and Drainage Authority,,Sacramento Valley; Feather River; Sacramento River,,,A large basin composed of a complex of levees and channels bound by the Feather and Sacramento Rivers.,presence,1938?,presence,1938?,presence,1938?,presence,1938?,N/A,N/A,N/A,N/A,Both,N/A,1938?,N/A,N/A
aech_00220,Sweetwater Reservoir/Sweetwater Lake,California,113576,668,32.6965681,-116.9904782,2.8,reservoir,1888,,,,,Sweetwater Authority,irrigation,San Diego county; Sweetwater River,,,"Provides water to National City, Bonita, and parts of Chula Vista.",48,1998,48,1998,presence,"1956, 1966, 1998",presence,1998,1,1966,1,1966,"Both: Clark's/Western in 1998 (8/40), Western (1966), mostly Clark's (1981?, 1994?)",N/A,"1956, 4 May 1998",N/A,N/A
aech_00221,"The 6 Lakes (Clear, Eagle, Almanor, Thermalito, Davis and Antelope)",California,,,,,,,,,,,,,,Clear Lake; Eagle Lake; Almanor Lake; Thermalito Afterbay; Lake Davis; Antelope Lake,,,"This is a summary of the 6 Lakes (Clear, Eagle, Almanor, Thermalito, Davis and Antelope).",N/A,N/A,N/A,N/A,N/A,N/A,N/A,N/A,N/A,N/A,N/A,N/A,N/A,N/A,N/A,N/A,N/A
aech_00222,Thermalito Afterbay,California,9215,152,39.457142,-121.644792,12.5,reservoir,1967,,,long-leaf pondweed,long-leaf pondweed,California Department of Fish and Wildlife; California Department of Water Resources,water supply; irrigation; hydroelectricity,Oroville Dam Complex; Lake Oroville; Oroville Wildlife Area; Feather River; Thermalito Forebay,,,"Part of Oroville Dam Complex, 5th most important grebe breeding lake in CA and they have nested there for at least 20 years. No consistent surveys until Dept of Water Resources started in 2004 and now collaborates with Altacal Audubon and Audubon's Grebe Conservation Project. Though number of threats named in this report, human disturbance from waterskiing and water level fluctuation are the main threats behind nest abandonment and low breeding success. Water flows through the Oroville-Thermalito Complex and into the Thermalito Forebay then into Thermalito Afterbay to be used to generate electricity. Altacal Audubon does extensive education and outreach on grebes of the lake.",573,2015,353,2019,315,2009,>63,2019,341,2014,82,2019,"Both Clark's/Western in 2003 (56/44), 1980s-2000, 2007-2019)",Shore; Boat; Air,"1980s, 4 September 2019","1(2009), 2(2007), 3(2003), varies up to weekly (2010 to 2019)","Water level too low, water level too high, lack of/poor nesting habitat, wind/wave inundation, egg predation, human/development/boat disturbance, nest abandonment, lack of fish food, water quality/contaminants/oil spills, drought/lack of precipitation/water"
aech_00223,Tinemaha Reservoir,California,112733,594,37.053543,-118.221648,2.6,reservoir,1928,,,,,California Department of Water Resources; City of Los Angeles Department of Water and Power,water supply; recreation; navigation,Owens Valley; Los Angeles Aqueduct System; base of Eastern Sierra Nevadas,,,One of the reservoirs that supplies water to Los Angeles via the Los Angeles Aqueduct System.,presence,2007,presence,2007,7,2007,7,2007,N/A,N/A,N/A,N/A,Both,Shore,16 August 2007,1,N/A
aech_00224,Topaz Lake,California,,,38.6808923,-119.5343007,,reservoir,,,,,,Mono County (CA); Douglas County (NV); Douglas County Parks and Recreation (NV),,Topaz Lake County Park; Topaz Lake Recreation Area; Eastern Sierra; Antelope Valley,,,"Part of Topaz Lake County Park and Topaz Lake Recreation Area, this is a man-made lake on the CA and NV border.",120,2007,presence,2013,presence,"1938, 1963",0,2007,0,2007,0,2007,Both,Shore; Boat,"1976, October 2013",N/A,"Water too low, lack of/poor nesting habitat, drought/lack of water, water quality/contaminants/oil spill"
aech_00225,Tulare Lake (historic),California,,,36.0666184,-119.7509624,,non-reservoir,,,,,,California Department of Fish and Wildlife; U.S. Fish and Wildlife Service,,Central Valley; San Joaquin Valley,,,"Was a large complex of wetlands until irrigation upstream cut off water sources to the lake, leaving it dry by 1899. Since then, the lakebed captures water from runoff, groundwater, and State Water Project and Central Valley Project water deliveries. Due to recent rains, water has flooded the area and filled the lake.",large #,historic (before 1977),large #,historic (before 1977),large #,historic (before 1977),large #,historic (before 1977),N/A,N/A,N/A,N/A,Both,N/A,historic (before 1977),N/A,"Lack of/poor nesting habitat, drought/lack of water"
aech_00227,"Tule Lake, Tule Lake National Wildlife Refuge",California,9165,125,41.934448,-121.517934,10.1,reservoir,1904,,,Tule (Typhus sp.); hardstem bulrush (Scirpus acutus),Tule (Typhus sp.); bulrush; sago pondweed,U.S. Fish and Wildlife Service; Bureau of Reclamation; Tulelake Irrigation District,irrigation,Tule Lake Basin; Klamath Basin; Great Basin; Lower Klamath National Wildlife Refuge; Upper Klamath National Wildlife Refuge,,,"Tule Lake and Tule Lake NWR (in general without specific location in the refuge) data compiled together because Tule Lake comprises most of the refuge. Finley (1907) observed large numbers of breeding grebes at Tule Lake and noted as colony site but hunters decimated this population. No year in this report but probably late 1800s or early 1900s. Ivey (2004) refers to Tule Lake as the second highest number of grebes of the selected sites at 17.3%, and 7.8% of the breeding grebe population of the Intermountain West (Ivey and Herziger in prep.). In summer of 2020, Ducks Unlimited partnered with various managing agencies to drawdown water from Sump 1B to expose mudflats for wetland vegetation seed germination.. These efforts were taken in hopes of providing nesting habitat for grebes. Tule Lake is considered highly productive and an important stopover site for migratory birds on the Pacific Flyway.",1330,2003,presence?,2013,636,2003,450,2009,480,1993,104,2008,"Both: Clark's/Western in 1981 (61 light/399 dark), in 1992, 1994, 2000, 2003 (14/98), in 2004 (157/1065), 2008, 2009, Western in 1997, 2001, 2002",Shore; Boat; Air,"late 1800s, 2013","Varies, 2 to daily (2003, 2004)","Water level too low, lack of/poor nesting habitat, water quality/contaminants/oil spills, drought/lack of precipitation/water, poaching/deliberate killing by humans"
